{"approved_by":"docs16-H5","attachments":[],"brief_sha":"24426eb8516148d30eda9f153ff7382780d1caff96606e5a1ae9f022c6d89f0b","change_kind":"new","change_reason":null,"created_by":{"model":"docs16-H5-TG4-fixed-brief","provider":"anthropic"},"declaration_sha":"d69f027c8ae8f9ef577caa4ffb3b1e04c314563c5c3fd1041b7bc8f917b1183b","evidence_sha":null,"lock_sha":"13cb026976d87a8544c473dad29f9ea3854620b5b0027fb1c69e0f9aa6c4a74f","objective":{"quantity":"total_length","sense":"min"},"operating_point":{"Q_m3_s":1.59,"T_K":293.15,"T_K_source":"assumed","U_exit_m_s":null,"flow_quote":"The flow rate is 1.590 m3/s","flow_source":"brief","fluid":"air","fluid_source":"assumed","mdot_kg_s":null,"p0_Pa":101325.0,"p0_Pa_source":"assumed"},"rows":[{"condition":{"Re":null,"level":null},"confidence":"high","ears":"The design shall have inlet diameter at contraction_start of 0.3 m within 5e-05 m.","feature":"contraction_start","hardness":"hard","id":"REQ-001","kind":"geometric","locks_params":["D_i"],"method":"geometry","op":"==","quantity":"inlet_diameter","quote":"The inlet diameter is 300 mm","source":"brief","standard_ref":null,"ticked":false,"tol_abs":5e-05,"tol_rel":null,"unit":"m","upper":null,"value":0.3},{"condition":{"Re":null,"level":null},"confidence":"high","ears":"The design shall have exit diameter at exit_plane of 0.21209999999999998 m within 5e-05 m.","feature":"exit_plane","hardness":"hard","id":"REQ-002","kind":"geometric","locks_params":["CR","D_i"],"method":"geometry","op":"==","quantity":"exit_diameter","quote":"the exit diameter is 212.1 mm","source":"brief","standard_ref":null,"ticked":false,"tol_abs":5e-05,"tol_rel":null,"unit":"m","upper":null,"value":0.21209999999999998},{"condition":{"Re":null,"level":null},"confidence":"high","ears":"The design shall satisfy separation free.","feature":null,"hardness":"hard","id":"REQ-003","kind":"performance","locks_params":[],"method":"cfd","op":"is_true","quantity":"separation_free","quote":"There must be no flow separation on the nozzle wall","source":"brief","standard_ref":null,"ticked":false,"tol_abs":null,"tol_rel":null,"unit":"1","upper":null,"value":null},{"condition":{"Re":null,"level":null},"confidence":"high","ears":"The design shall have exit nonuniformity at exit_plane of at most 0.01.","feature":"exit_plane","hardness":"hard","id":"REQ-004","kind":"performance","locks_params":[],"method":"cfd","op":"<=","quantity":"exit_nonuniformity","quote":"The exit non-uniformity must be at most 1 %","source":"brief","standard_ref":null,"ticked":false,"tol_abs":null,"tol_rel":null,"unit":"1","upper":null,"value":0.01},{"condition":{"Re":630000.0,"level":null},"confidence":"high","ears":"While Re is 630000.0, the design shall have k max apriori of at most 3e-06.","feature":null,"hardness":"hard","id":"REQ-005","kind":"geometric","locks_params":[],"method":"geometry","op":"<=","quantity":"k_max_apriori","quote":"The acceleration parameter K_max must be at most 3e-6 at Re_De 6.30e5","source":"brief","standard_ref":null,"ticked":false,"tol_abs":null,"tol_rel":null,"unit":"1","upper":null,"value":3e-06},{"condition":{"Re":null,"level":null},"confidence":"high","ears":"The design shall have min wall normal of at least 0.003 m.","feature":null,"hardness":"hard","id":"REQ-006","kind":"geometric","locks_params":[],"method":"geometry","op":">=","quantity":"min_wall_normal","quote":"The wall thickness normal to the wall must be at least 3 mm","source":"brief","standard_ref":null,"ticked":false,"tol_abs":null,"tol_rel":null,"unit":"m","upper":null,"value":0.003},{"condition":{"Re":null,"level":null},"confidence":"high","ears":"The design should minimise total length.","feature":null,"hardness":"objective","id":"REQ-007","kind":"geometric","locks_params":[],"method":"geometry","op":"<=","quantity":"total_length","quote":"Make the total length as short as possible","source":"brief","standard_ref":null,"ticked":false,"tol_abs":null,"tol_rel":null,"unit":"m","upper":null,"value":null},{"condition":{"Re":null,"level":null},"confidence":"high","ears":"The design shall be exactly one solid.","feature":null,"hardness":"hard","id":"SYS-SOLID","kind":"geometric","locks_params":[],"method":"geometry","op":"==","quantity":"n_solids","quote":null,"source":"system","standard_ref":null,"ticked":false,"tol_abs":null,"tol_rel":null,"unit":"1","upper":null,"value":1.0},{"condition":{"Re":null,"level":null},"confidence":"high","ears":"The design shall be a valid BREP at every stage.","feature":null,"hardness":"hard","id":"SYS-VALID","kind":"geometric","locks_params":[],"method":"geometry","op":"is_true","quantity":"valid","quote":null,"source":"system","standard_ref":null,"ticked":false,"tol_abs":null,"tol_rel":null,"unit":"1","upper":null,"value":null},{"condition":{"Re":null,"level":null},"confidence":"high","ears":"The design shall be watertight.","feature":null,"hardness":"hard","id":"SYS-WATERTIGHT","kind":"geometric","locks_params":[],"method":"geometry","op":"is_true","quantity":"watertight","quote":null,"source":"system","standard_ref":null,"ticked":false,"tol_abs":null,"tol_rel":null,"unit":"1","upper":null,"value":null},{"condition":{"Re":null,"level":null},"confidence":"high","ears":"The design shall be revolved about the +x axis.","feature":null,"hardness":"hard","id":"SYS-AXIS","kind":"geometric","locks_params":[],"method":"geometry","op":"is_true","quantity":"axis","quote":null,"source":"system","standard_ref":null,"ticked":false,"tol_abs":null,"tol_rel":null,"unit":"1","upper":null,"value":null},{"condition":{"Re":null,"level":null},"confidence":"high","ears":"The design shall be in metres at scale 1.","feature":null,"hardness":"hard","id":"SYS-UNITS","kind":"geometric","locks_params":[],"method":"geometry","op":"is_true","quantity":"units","quote":null,"source":"system","standard_ref":null,"ticked":false,"tol_abs":null,"tol_rel":null,"unit":"1","upper":null,"value":null},{"condition":{"Re":null,"level":null},"confidence":"high","ears":"The design shall keep the Mach number at or below 0.3.","feature":null,"hardness":"hard","id":"SYS-MACH","kind":"performance","locks_params":[],"method":"cfd","op":"<=","quantity":"mach_max","quote":null,"source":"system","standard_ref":null,"ticked":false,"tol_abs":null,"tol_rel":null,"unit":"1","upper":null,"value":0.3}],"schema":"cad-requirements/1","study_id":"tg4_nozzle","supersedes_lock":null,"supersedes_study":null,"template_id":"nozzle_contraction/1","template_sha":"d7a7a55336fa404f4a22ec2aff7288f785cdb116f032eb24cb73d03807e4473f","vocab_sha":"bf74cfb2a0e9c25796e753c53545cb2721ddfcef5dc44a6c9eec6db9602ec790"}
